{
  "id": "countries",
  "icon": "🌍",
  "name": {"tr": "Ülkeler", "en": "Countries", "es": "Países", "fr": "Pays", "de": "Länder", "it": "Paesi", "pt": "Países", "ru": "Страны", "ar": "دول", "zh": "国家"},
  "drawable": false,
  "words": [
    {
      "word": {"tr": "İtalya", "en": "Italy", "es": "Italia", "fr": "Italie", "de": "Italien", "it": "Italia", "pt": "Itália", "ru": "Италия", "ar": "إيطاليا", "zh": "意大利"},
      "clues": [
        {"tr": "El hareketi", "en": "Hand gestures", "es": "Gestos con las manos", "fr": "Gestes des mains", "de": "Handgesten", "it": "Gesti con le mani", "pt": "Gestos com as mãos", "ru": "Жестикуляция", "ar": "إشارات اليد", "zh": "手势"},
        {"tr": "Opera", "en": "Opera", "es": "Ópera", "fr": "Opéra", "de": "Oper", "it": "Opera", "pt": "Ópera", "ru": "Опера", "ar": "أوبرا", "zh": "歌剧"}
      ]
    },
    {
      "word": {"tr": "Fransa", "en": "France", "es": "Francia", "fr": "France", "de": "Frankreich", "it": "Francia", "pt": "França", "ru": "Франция", "ar": "فرنسا", "zh": "法国"},
      "clues": [
        {"tr": "Peynir", "en": "Cheese", "es": "Queso", "fr": "Fromage", "de": "Käse", "it": "Formaggio", "pt": "Queijo", "ru": "Сыр", "ar": "جبن", "zh": "奶酪"},
        {"tr": "Bere", "en": "Beret", "es": "Boina", "fr": "Béret", "de": "Baskenmütze", "it": "Basco", "pt": "Boina", "ru": "Берет", "ar": "بيريه", "zh": "贝雷帽"}
      ]
    },
    {
      "word": {"tr": "Japonya", "en": "Japan", "es": "Japón", "fr": "Japon", "de": "Japan", "it": "Giappone", "pt": "Japão", "ru": "Япония", "ar": "اليابان", "zh": "日本"},
      "clues": [
        {"tr": "Dakiklik", "en": "Punctuality", "es": "Puntualidad", "fr": "Ponctualité", "de": "Pünktlichkeit", "it": "Puntualità", "pt": "Pontualidade", "ru": "Пунктуальность", "ar": "الدقة في المواعيد", "zh": "守时"},
        {"tr": "Eğilmek", "en": "Bowing", "es": "Reverencia", "fr": "Courbette", "de": "Verbeugung", "it": "Inchino", "pt": "Reverência", "ru": "Поклон", "ar": "انحناء", "zh": "鞠躬"}
      ]
    },
    {
      "word": {"tr": "Mısır", "en": "Egypt", "es": "Egipto", "fr": "Égypte", "de": "Ägypten", "it": "Egitto", "pt": "Egito", "ru": "Египет", "ar": "مصر", "zh": "埃及"},
      "clues": [
        {"tr": "Kedi", "en": "Cats", "es": "Gatos", "fr": "Chats", "de": "Katzen", "it": "Gatti", "pt": "Gatos", "ru": "Кошки", "ar": "قطط", "zh": "猫"},
        {"tr": "Pamuk", "en": "Cotton", "es": "Algodón", "fr": "Coton", "de": "Baumwolle", "it": "Cotone", "pt": "Algodão", "ru": "Хлопок", "ar": "قطن", "zh": "棉花"}
      ]
    },
    {
      "word": {"tr": "Brezilya", "en": "Brazil", "es": "Brasil", "fr": "Brésil", "de": "Brasilien", "it": "Brasile", "pt": "Brasil", "ru": "Бразилия", "ar": "البرازيل", "zh": "巴西"},
      "clues": [
        {"tr": "Karnaval", "en": "Carnival", "es": "Carnaval", "fr": "Carnaval", "de": "Karneval", "it": "Carnevale", "pt": "Carnaval", "ru": "Карнавал", "ar": "كرنفال", "zh": "狂欢节"},
        {"tr": "Kahve", "en": "Coffee", "es": "Café", "fr": "Café", "de": "Kaffee", "it": "Caffè", "pt": "Café", "ru": "Кофе", "ar": "قهوة", "zh": "咖啡"}
      ]
    },
    {
      "word": {"tr": "Küba", "en": "Cuba", "es": "Cuba", "fr": "Cuba", "de": "Kuba", "it": "Cuba", "pt": "Cuba", "ru": "Куба", "ar": "كوبا", "zh": "古巴"},
      "clues": [
        {"tr": "Eski arabalar", "en": "Vintage cars", "es": "Coches antiguos", "fr": "Vieilles voitures", "de": "Oldtimer", "it": "Auto d'epoca", "pt": "Carros antigos", "ru": "Старые машины", "ar": "سيارات قديمة", "zh": "老爷车"},
        {"tr": "Salsa", "en": "Salsa", "es": "Salsa", "fr": "Salsa", "de": "Salsa", "it": "Salsa", "pt": "Salsa", "ru": "Сальса", "ar": "سالسا", "zh": "萨尔萨舞"}
      ]
    },
    {
      "word": {"tr": "Çin", "en": "China", "es": "China", "fr": "Chine", "de": "China", "it": "Cina", "pt": "China", "ru": "Китай", "ar": "الصين", "zh": "中国"},
      "clues": [
        {"tr": "Kalabalık", "en": "Crowded", "es": "Multitud", "fr": "Foule", "de": "Menschenmenge", "it": "Folla", "pt": "Multidão", "ru": "Многолюдно", "ar": "مزدحم", "zh": "人多"},
        {"tr": "Çubuk", "en": "Chopsticks", "es": "Palillos", "fr": "Baguettes", "de": "Stäbchen", "it": "Bacchette", "pt": "Hashi", "ru": "Палочки", "ar": "عيدان", "zh": "筷子"}
      ]
    },
    {
      "word": {"tr": "Rusya", "en": "Russia", "es": "Rusia", "fr": "Russie", "de": "Russland", "it": "Russia", "pt": "Rússia", "ru": "Россия", "ar": "روسيا", "zh": "俄罗斯"},
      "clues": [
        {"tr": "Kış", "en": "Winter", "es": "Invierno", "fr": "Hiver", "de": "Winter", "it": "Inverno", "pt": "Inverno", "ru": "Зима", "ar": "شتاء", "zh": "冬天"},
        {"tr": "Bale", "en": "Ballet", "es": "Ballet", "fr": "Ballet", "de": "Ballett", "it": "Balletto", "pt": "Balé", "ru": "Балет", "ar": "باليه", "zh": "芭蕾"}
      ]
    },
    {
      "word": {"tr": "Hindistan", "en": "India", "es": "India", "fr": "Inde", "de": "Indien", "it": "India", "pt": "Índia", "ru": "Индия", "ar": "الهند", "zh": "印度"},
      "clues": [
        {"tr": "Baharat", "en": "Spices", "es": "Especias", "fr": "Épices", "de": "Gewürze", "it": "Spezie", "pt": "Especiarias", "ru": "Специи", "ar": "بهارات", "zh": "香料"},
        {"tr": "Kriket", "en": "Cricket", "es": "Críquet", "fr": "Cricket", "de": "Cricket", "it": "Cricket", "pt": "Críquete", "ru": "Крикет", "ar": "كريكيت", "zh": "板球"}
      ]
    },
    {
      "word": {"tr": "Meksika", "en": "Mexico", "es": "México", "fr": "Mexique", "de": "Mexiko", "it": "Messico", "pt": "México", "ru": "Мексика", "ar": "المكسيك", "zh": "墨西哥"},
      "clues": [
        {"tr": "Acı", "en": "Spicy", "es": "Picante", "fr": "Épicé", "de": "Scharf", "it": "Piccante", "pt": "Apimentado", "ru": "Острое", "ar": "حار", "zh": "辣"},
        {"tr": "Kaktüs", "en": "Cactus", "es": "Cactus", "fr": "Cactus", "de": "Kaktus", "it": "Cactus", "pt": "Cacto", "ru": "Кактус", "ar": "صبار", "zh": "仙人掌"}
      ]
    },
    {
      "word": {"tr": "İngiltere", "en": "England", "es": "Inglaterra", "fr": "Angleterre", "de": "England", "it": "Inghilterra", "pt": "Inglaterra", "ru": "Англия", "ar": "إنجلترا", "zh": "英国"},
      "clues": [
        {"tr": "Yağmur", "en": "Rain", "es": "Lluvia", "fr": "Pluie", "de": "Regen", "it": "Pioggia", "pt": "Chuva", "ru": "Дождь", "ar": "مطر", "zh": "雨"},
        {"tr": "Sol şerit", "en": "Driving on the left", "es": "Conducir por la izquierda", "fr": "Conduite à gauche", "de": "Linksverkehr", "it": "Guida a sinistra", "pt": "Dirigir pela esquerda", "ru": "Левостороннее движение", "ar": "القيادة على اليسار", "zh": "靠左行驶"}
      ]
    },
    {
      "word": {"tr": "Almanya", "en": "Germany", "es": "Alemania", "fr": "Allemagne", "de": "Deutschland", "it": "Germania", "pt": "Alemanha", "ru": "Германия", "ar": "ألمانيا", "zh": "德国"},
      "clues": [
        {"tr": "Otomobil", "en": "Cars", "es": "Coches", "fr": "Voitures", "de": "Autos", "it": "Auto", "pt": "Carros", "ru": "Автомобили", "ar": "سيارات", "zh": "汽车"},
        {"tr": "Kurallar", "en": "Rules", "es": "Reglas", "fr": "Règles", "de": "Regeln", "it": "Regole", "pt": "Regras", "ru": "Правила", "ar": "قواعد", "zh": "规矩"}
      ]
    },
    {
      "word": {"tr": "İspanya", "en": "Spain", "es": "España", "fr": "Espagne", "de": "Spanien", "it": "Spagna", "pt": "Espanha", "ru": "Испания", "ar": "إسبانيا", "zh": "西班牙"},
      "clues": [
        {"tr": "Öğle uykusu", "en": "Siesta", "es": "Siesta", "fr": "Sieste", "de": "Mittagsschlaf", "it": "Pisolino", "pt": "Sesta", "ru": "Сиеста", "ar": "قيلولة", "zh": "午睡"},
        {"tr": "Zeytin", "en": "Olives", "es": "Aceitunas", "fr": "Olives", "de": "Oliven", "it": "Olive", "pt": "Azeitonas", "ru": "Оливки", "ar": "زيتون", "zh": "橄榄"}
      ]
    },
    {
      "word": {"tr": "Yunanistan", "en": "Greece", "es": "Grecia", "fr": "Grèce", "de": "Griechenland", "it": "Grecia", "pt": "Grécia", "ru": "Греция", "ar": "اليونان", "zh": "希腊"},
      "clues": [
        {"tr": "Adalar", "en": "Islands", "es": "Islas", "fr": "Îles", "de": "Inseln", "it": "Isole", "pt": "Ilhas", "ru": "Острова", "ar": "جزر", "zh": "岛屿"},
        {"tr": "Beyaz mavi", "en": "White and blue", "es": "Blanco y azul", "fr": "Blanc et bleu", "de": "Weiß und Blau", "it": "Bianco e blu", "pt": "Branco e azul", "ru": "Бело-голубой", "ar": "أبيض وأزرق", "zh": "蓝白"}
      ]
    },
    {
      "word": {"tr": "Avustralya", "en": "Australia", "es": "Australia", "fr": "Australie", "de": "Australien", "it": "Australia", "pt": "Austrália", "ru": "Австралия", "ar": "أستراليا", "zh": "澳大利亚"},
      "clues": [
        {"tr": "Ters dünya", "en": "Down under", "es": "Antípodas", "fr": "Antipodes", "de": "Down Under", "it": "Antipodi", "pt": "Antípodas", "ru": "Другой конец света", "ar": "الطرف الآخر من العالم", "zh": "地球另一端"},
        {"tr": "Örümcek", "en": "Spiders", "es": "Arañas", "fr": "Araignées", "de": "Spinnen", "it": "Ragni", "pt": "Aranhas", "ru": "Пауки", "ar": "عناكب", "zh": "蜘蛛"}
      ]
    },
    {
      "word": {"tr": "Kanada", "en": "Canada", "es": "Canadá", "fr": "Canada", "de": "Kanada", "it": "Canada", "pt": "Canadá", "ru": "Канада", "ar": "كندا", "zh": "加拿大"},
      "clues": [
        {"tr": "Kibar", "en": "Polite", "es": "Educado", "fr": "Poli", "de": "Höflich", "it": "Educato", "pt": "Educado", "ru": "Вежливый", "ar": "مهذب", "zh": "礼貌"},
        {"tr": "Ayı", "en": "Bears", "es": "Osos", "fr": "Ours", "de": "Bären", "it": "Orsi", "pt": "Ursos", "ru": "Медведи", "ar": "دببة", "zh": "熊"}
      ]
    },
    {
      "word": {"tr": "Hollanda", "en": "Netherlands", "es": "Países Bajos", "fr": "Pays-Bas", "de": "Niederlande", "it": "Paesi Bassi", "pt": "Países Baixos", "ru": "Нидерланды", "ar": "هولندا", "zh": "荷兰"},
      "clues": [
        {"tr": "Bisiklet", "en": "Bicycle", "es": "Bicicleta", "fr": "Vélo", "de": "Fahrrad", "it": "Bicicletta", "pt": "Bicicleta", "ru": "Велосипед", "ar": "دراجة", "zh": "自行车"},
        {"tr": "Turuncu", "en": "Orange", "es": "Naranja", "fr": "Orange", "de": "Orange", "it": "Arancione", "pt": "Laranja", "ru": "Оранжевый", "ar": "برتقالي", "zh": "橙色"}
      ]
    },
    {